{
  "artifact_id": "g2-requirements-agent-attestation",
  "revision": "1",
  "kind": "gate-attestation",
  "authors": [
    "requirements-agent"
  ],
  "verifiers": [],
  "upstream_ids": [
    "requirements-baseline-sdlc-guardrails-20260724-r2"
  ],
  "downstream_ids": [
    "SDLC-GUARDRAILS-20260724-R2:G2"
  ],
  "provenance": {
    "created_at": "2026-07-24T05:18:28Z",
    "ai_generated": true
  },
  "evidence": [
    {
      "summary": "G2 requirements baseline drafted from approved G1 intent with stable requirement IDs, acceptance criteria, dependencies, obligations, and downstream gate applicability."
    }
  ]
}
