{
  "artifact_id": "g1-code-reviewer-attestation",
  "revision": "2",
  "kind": "gate-attestation",
  "authors": [
    "019f928a-afd4-7962-910e-e1d0a8cbe245"
  ],
  "verifiers": [],
  "upstream_ids": [
    "intent-record-sdlc-guardrails-20260724-r2"
  ],
  "downstream_ids": [
    "SDLC-GUARDRAILS-20260724-R2:G1"
  ],
  "provenance": {
    "created_at": "2026-07-24T05:15:24Z",
    "ai_generated": true
  },
  "evidence": [
    {
      "summary": "Independent code-reviewer re-reviewed the completed G1 package and returned ready-for-human-decision with no blocking findings."
    }
  ]
}
