{
  "artifact_id": "g6-application-engineer-attestation",
  "revision": "1",
  "kind": "gate-attestation",
  "authors": [
    "application-engineer"
  ],
  "verifiers": [],
  "upstream_ids": [
    "verification-record-sdlc-guardrails-20260724-r2"
  ],
  "downstream_ids": [
    "SDLC-GUARDRAILS-20260724-R2:G6"
  ],
  "provenance": {
    "created_at": "2026-07-24T05:37:35Z",
    "ai_generated": true
  },
  "evidence": [
    {
      "summary": "Application-engineer prepared the G6 verification package for commit 925f2241eea688eb53cd42c83fb05596a139bdd5, including positive auto-advance coverage, deterministic negative-path validator coverage, full plugin tests, repository health, and a validator-clean run record."
    }
  ]
}
