{
  "artifact_id": "g2-requirements-agent-attestation",
  "revision": "1",
  "kind": "agent-attestation",
  "authors": [
    "requirements-agent"
  ],
  "verifiers": [],
  "upstream_ids": [
    "requirements-baseline-github-review-approvals-2026-07-24"
  ],
  "downstream_ids": [
    "github-review-approvals-2026-07-24:G2"
  ],
  "provenance": {
    "created_at": "2026-07-24T06:19:00Z",
    "ai_generated": true
  },
  "evidence": [
    {
      "evidence_id": "g2-attestation-summary",
      "type": "agent-summary",
      "task_id": "github-review-approvals-2026-07-24",
      "agent_id": "requirements-agent",
      "summary": "Prepared the G2 requirements baseline for GitHub-review-backed approvals, covering CLI behavior, approval-source policy enforcement, repository overlay defaults, and documentation obligations."
    }
  ]
}
