{
  "artifact_id": "g1-product-intent-agent-attestation",
  "revision": "1",
  "kind": "gate-attestation",
  "authors": [
    "product-intent-agent"
  ],
  "verifiers": [],
  "upstream_ids": [
    "intent-record-sdlc-guardrails-20260724-r2"
  ],
  "downstream_ids": [
    "SDLC-GUARDRAILS-20260724-R2:G1"
  ],
  "provenance": {
    "created_at": "2026-07-24T05:12:12Z",
    "ai_generated": true
  },
  "evidence": [
    {
      "summary": "G1 intent artifact prepared and refreshed to revision 2, bound to the run record, and aligned with the current overlay state."
    }
  ]
}
